{
  "fixture_notice": "Independently authored synthetic records and gold judgments; not derived from MIMIC or any real patient.",
  "patients": [
    {
      "patient_id": "synthetic-patient-a",
      "index_date": "2026-01-01",
      "facts": [
        {
          "fact_id": "a-age-fact",
          "field": "age",
          "value": {
            "value_type": "number",
            "value": 55,
            "unit": "years"
          },
          "evidence_ids": [
            "a-demographics"
          ]
        },
        {
          "fact_id": "a-egfr-fact",
          "field": "egfr",
          "value": {
            "value_type": "number",
            "value": 82,
            "unit": "mL/min/1.73m2"
          },
          "evidence_ids": [
            "a-renal"
          ],
          "observed_at": "2025-12-29"
        },
        {
          "fact_id": "a-bleeding-fact",
          "field": "active_bleeding",
          "value": {
            "value_type": "boolean",
            "value": false
          },
          "evidence_ids": [
            "a-bleeding"
          ],
          "observed_at": "2025-12-20"
        },
        {
          "fact_id": "a-diabetes-fact",
          "field": "diabetes",
          "value": {
            "value_type": "boolean",
            "value": true
          },
          "evidence_ids": [
            "a-diabetes"
          ]
        }
      ],
      "evidence": [
        {
          "evidence_id": "a-demographics",
          "source_id": "synthetic-note-a",
          "text": "The fictional participant is 55 years old."
        },
        {
          "evidence_id": "a-renal",
          "source_id": "synthetic-lab-a",
          "text": "Synthetic laboratory record: eGFR 82 mL/min/1.73m2."
        },
        {
          "evidence_id": "a-bleeding",
          "source_id": "synthetic-note-a",
          "text": "The synthetic record states that active bleeding is absent."
        },
        {
          "evidence_id": "a-diabetes",
          "source_id": "synthetic-note-a",
          "text": "The fictional history includes diabetes."
        }
      ]
    },
    {
      "patient_id": "synthetic-patient-b",
      "index_date": "2026-01-01",
      "facts": [
        {
          "fact_id": "b-age-fact",
          "field": "age",
          "value": {
            "value_type": "number",
            "value": 70,
            "unit": "years"
          },
          "evidence_ids": [
            "b-demographics"
          ]
        },
        {
          "fact_id": "b-egfr-fact",
          "field": "egfr",
          "value": {
            "value_type": "number",
            "value": 40,
            "unit": "mL/min/1.73m2"
          },
          "evidence_ids": [
            "b-renal"
          ],
          "observed_at": "2025-12-28"
        },
        {
          "fact_id": "b-bleeding-fact",
          "field": "active_bleeding",
          "value": {
            "value_type": "boolean",
            "value": false
          },
          "evidence_ids": [
            "b-bleeding"
          ],
          "observed_at": "2025-12-22"
        },
        {
          "fact_id": "b-diabetes-fact",
          "field": "diabetes",
          "value": {
            "value_type": "boolean",
            "value": false
          },
          "evidence_ids": [
            "b-diabetes"
          ]
        }
      ],
      "evidence": [
        {
          "evidence_id": "b-demographics",
          "source_id": "synthetic-note-b",
          "text": "The fictional participant is 70 years old."
        },
        {
          "evidence_id": "b-renal",
          "source_id": "synthetic-lab-b",
          "text": "Synthetic laboratory record: eGFR 40 mL/min/1.73m2."
        },
        {
          "evidence_id": "b-bleeding",
          "source_id": "synthetic-note-b",
          "text": "The synthetic record states that active bleeding is absent."
        },
        {
          "evidence_id": "b-diabetes",
          "source_id": "synthetic-note-b",
          "text": "The fictional history states that diabetes is absent."
        }
      ]
    }
  ],
  "trials": [
    {
      "trial_id": "synthetic-trial-renal-high",
      "title": "Synthetic high renal-function study",
      "criteria": [
        {
          "criterion_id": "renal-high-age",
          "criterion_type": "inclusion",
          "description": "Adult participant",
          "hard": true,
          "expression": {
            "expression_type": "atom",
            "atom": {
              "condition_id": "renal-high-age-min",
              "field": "age",
              "operator": ">=",
              "fact_selection": "any",
              "expected": {
                "value_type": "number",
                "value": 18,
                "unit": "years"
              },
              "provenance": {
                "source_id": "synthetic-protocol:synthetic-trial-renal-high:renal-high-age",
                "source_span": {
                  "start": 0,
                  "end": 17
                },
                "method": "human"
              }
            }
          },
          "source": {
            "source_id": "synthetic-protocol:synthetic-trial-renal-high:renal-high-age",
            "source_text": "Adult participant",
            "section": "inclusion",
            "document_version": "synthetic-v1"
          }
        },
        {
          "criterion_id": "renal-high-egfr-range",
          "criterion_type": "inclusion",
          "description": "eGFR is between 50 inclusive and 90 exclusive",
          "hard": true,
          "expression": {
            "expression_type": "all",
            "children": [
              {
                "expression_type": "atom",
                "atom": {
                  "condition_id": "renal-high-egfr-min",
                  "field": "egfr",
                  "operator": ">=",
                  "fact_selection": "latest",
                  "expected": {
                    "value_type": "number",
                    "value": 50,
                    "unit": "mL/min/1.73m2"
                  },
                  "provenance": {
                    "source_id": "synthetic-protocol:synthetic-trial-renal-high:renal-high-egfr-range",
                    "source_span": {
                      "start": 0,
                      "end": 45
                    },
                    "method": "human"
                  }
                }
              },
              {
                "expression_type": "atom",
                "atom": {
                  "condition_id": "renal-high-egfr-max",
                  "field": "egfr",
                  "operator": "<",
                  "fact_selection": "latest",
                  "expected": {
                    "value_type": "number",
                    "value": 90,
                    "unit": "mL/min/1.73m2"
                  },
                  "provenance": {
                    "source_id": "synthetic-protocol:synthetic-trial-renal-high:renal-high-egfr-range",
                    "source_span": {
                      "start": 0,
                      "end": 45
                    },
                    "method": "human"
                  }
                }
              }
            ]
          },
          "source": {
            "source_id": "synthetic-protocol:synthetic-trial-renal-high:renal-high-egfr-range",
            "source_text": "eGFR is between 50 inclusive and 90 exclusive",
            "section": "inclusion",
            "document_version": "synthetic-v1"
          }
        },
        {
          "criterion_id": "renal-high-recent-bleeding",
          "criterion_type": "exclusion",
          "description": "Active bleeding in the prior 30 days excludes participation",
          "hard": true,
          "expression": {
            "expression_type": "atom",
            "atom": {
              "condition_id": "renal-high-bleeding-window",
              "field": "active_bleeding",
              "operator": "==",
              "fact_selection": "any",
              "expected": {
                "value_type": "boolean",
                "value": true
              },
              "time_window": {
                "days": 30,
                "direction": "past",
                "relative_to": "index_date"
              },
              "provenance": {
                "source_id": "synthetic-protocol:synthetic-trial-renal-high:renal-high-recent-bleeding",
                "source_span": {
                  "start": 0,
                  "end": 59
                },
                "method": "human"
              }
            }
          },
          "source": {
            "source_id": "synthetic-protocol:synthetic-trial-renal-high:renal-high-recent-bleeding",
            "source_text": "Active bleeding in the prior 30 days excludes participation",
            "section": "exclusion",
            "document_version": "synthetic-v1"
          }
        }
      ]
    },
    {
      "trial_id": "synthetic-trial-metabolic",
      "title": "Synthetic metabolic-control study",
      "criteria": [
        {
          "criterion_id": "metabolic-age",
          "criterion_type": "inclusion",
          "description": "Participant is at least 21",
          "hard": true,
          "expression": {
            "expression_type": "atom",
            "atom": {
              "condition_id": "metabolic-age-min",
              "field": "age",
              "operator": ">=",
              "fact_selection": "any",
              "expected": {
                "value_type": "number",
                "value": 21,
                "unit": "years"
              },
              "provenance": {
                "source_id": "synthetic-protocol:synthetic-trial-metabolic:metabolic-age",
                "source_span": {
                  "start": 0,
                  "end": 26
                },
                "method": "human"
              }
            }
          },
          "source": {